{
  "schemaId": "CARTAO_PONTO",
  "schemaVersion": 1,
  "jobId": "8a0c0d4d-0f3a-4a5f-a8f1-1f7c3d2a9b21",
  "extractedAt": "2026-02-20T12:34:56Z",
  "days": [
    {
      "date": "2026-02-01",
      "punches": [
        {
          "time": "08:00",
          "type": "IN"
        },
        {
          "time": "12:00",
          "type": "OUT"
        }
      ]
    }
  ]
}
